[
  {
    "schema_name": "a_short_regime_comparison_weekly",
    "schema_version": "1.0.0",
    "as_of": "20260612",
    "generated_at": null,
    "v14_2_regime": "unknown",
    "v14_3_raw_regime": "contraction",
    "divergence": true,
    "v14_3_fired_rule": "earning_effect_gone",
    "v14_3_window_n": 252,
    "v14_3_insufficient_window": false,
    "data_quality_flags": [],
    "forward_returns": {
      "h1": 3.882015,
      "h3": 6.115822,
      "h5": null,
      "h10": null
    },
    "forward_returns_pending": [
      "h5",
      "h10"
    ],
    "backfill_complete": false,
    "forward_return_basis": {
      "benchmark": "000852.SH",
      "benchmark_name": "CSI1000",
      "measure": "forward_close_to_close_simple_return",
      "horizons_trading_days": {
        "h1": 1,
        "h3": 3,
        "h5": 5,
        "h10": 10
      },
      "unit": "percent",
      "price_basis": "index_close_unadjusted",
      "cost_basis": "gross",
      "scope": "market_level_regime_indicator"
    },
    "boundary": {
      "production": false,
      "comparison_only": true,
      "drives_phase5_risk_posture": false,
      "mixes_with_overlay_star_or_m67_action": false
    }
  },
  {
    "schema_name": "a_short_regime_comparison_weekly",
    "schema_version": "1.0.0",
    "as_of": "20260618",
    "generated_at": null,
    "v14_2_regime": "unknown",
    "v14_3_raw_regime": "contraction",
    "divergence": true,
    "v14_3_fired_rule": "earning_effect_gone",
    "v14_3_window_n": 252,
    "v14_3_insufficient_window": false,
    "data_quality_flags": [],
    "forward_returns": {
      "h1": null,
      "h3": null,
      "h5": null,
      "h10": null
    },
    "forward_returns_pending": [
      "h1",
      "h3",
      "h5",
      "h10"
    ],
    "backfill_complete": false,
    "forward_return_basis": {
      "benchmark": "000852.SH",
      "benchmark_name": "CSI1000",
      "measure": "forward_close_to_close_simple_return",
      "horizons_trading_days": {
        "h1": 1,
        "h3": 3,
        "h5": 5,
        "h10": 10
      },
      "unit": "percent",
      "price_basis": "index_close_unadjusted",
      "cost_basis": "gross",
      "scope": "market_level_regime_indicator"
    },
    "boundary": {
      "production": false,
      "comparison_only": true,
      "drives_phase5_risk_posture": false,
      "mixes_with_overlay_star_or_m67_action": false
    }
  }
]